{
  "$schema": "https://json-schema.org/draft/2020-12/schema",
  "$id": "https://github.com/yaney01/skill/ppt/schemas/deck.schema.json",
  "title": "HTML PPT production manifest",
  "type": "object",
  "required": ["manifestVersion", "id", "title", "language", "density", "visualStrategy", "slides"],
  "properties": {
    "manifestVersion": { "type": "integer", "minimum": 2 },
    "id": { "type": "string", "minLength": 1 },
    "title": { "type": "string", "minLength": 1 },
    "language": { "type": "string", "minLength": 2 },
    "density": { "enum": ["speaker-led", "reading-first"] },
    "style": { "type": "string" },
    "themeName": { "type": ["string", "null"] },
    "themeTier": { "type": ["string", "null"] },
    "layoutRegistry": { "type": "string", "minLength": 1 },
    "purpose": { "type": "string" },
    "source": {
      "type": "object",
      "required": ["manifest", "originalFile", "type", "mode", "mapping"],
      "properties": {
        "manifest": { "type": "string", "minLength": 1 },
        "originalFile": { "type": "string", "minLength": 1 },
        "type": { "enum": ["pptx", "docx", "pdf", "markdown"] },
        "mode": { "enum": ["semantic", "preserve-layout"] },
        "mapping": {
          "type": "array",
          "items": { "$ref": "#/$defs/sourceMapping" }
        }
      },
      "additionalProperties": true
    },
    "visualStrategy": {
      "type": "object",
      "required": ["mode", "targetCoverage", "targetEvidenceCoverage", "maxConsecutiveTextOnly"],
      "properties": {
        "mode": {
          "enum": ["supplied", "generated", "diagram-first", "generated-and-diagram", "mixed", "typography-led"]
        },
        "targetCoverage": { "type": "number", "minimum": 0, "maximum": 1 },
        "targetEvidenceCoverage": { "type": "number", "minimum": 0, "maximum": 1 },
        "maxConsecutiveTextOnly": { "type": "integer", "minimum": 0 },
        "notes": { "type": "string" }
      },
      "additionalProperties": true
    },
    "visualProduction": {
      "type": "object",
      "properties": {
        "workOrders": { "type": "string", "minLength": 1 },
        "stage": { "enum": ["planning", "delivery"] },
        "syncedAt": { "type": "string" }
      },
      "additionalProperties": true
    },
    "slides": {
      "type": "array",
      "minItems": 1,
      "items": { "$ref": "#/$defs/slide" }
    },
    "createdAt": { "type": "string" },
    "generator": { "type": "string" }
  },
  "additionalProperties": true,
  "$defs": {
    "sourceMapping": {
      "type": "object",
      "required": ["sourceIds", "slideIds", "treatment", "reason"],
      "properties": {
        "sourceIds": {
          "type": "array",
          "minItems": 1,
          "items": { "type": "string", "pattern": "^page-[0-9]{3,}$" }
        },
        "slideIds": {
          "type": "array",
          "items": { "type": "string", "minLength": 1 }
        },
        "treatment": {
          "enum": ["preserve", "split", "merge", "condense", "omit", "redraw-chart", "retain-pixel-faithful"]
        },
        "reason": { "type": "string", "minLength": 1 }
      },
      "allOf": [
        {
          "if": { "properties": { "treatment": { "const": "omit" } } },
          "then": { "properties": { "slideIds": { "maxItems": 0 } } },
          "else": { "properties": { "slideIds": { "minItems": 1 } } }
        }
      ],
      "additionalProperties": true
    },
    "slide": {
      "type": "object",
      "required": ["id", "purpose", "layout", "headline", "visual"],
      "properties": {
        "id": { "type": "string", "minLength": 1 },
        "purpose": { "type": "string", "minLength": 1 },
        "layout": { "type": "string", "minLength": 1 },
        "headline": { "type": "string" },
        "notes": { "type": "string" },
        "sourceIds": { "type": "array", "items": { "type": "string" } },
        "visual": { "$ref": "#/$defs/visual" }
      },
      "additionalProperties": true
    },
    "visual": {
      "type": "object",
      "required": ["type", "required", "status", "source", "role"],
      "properties": {
        "assetId": { "type": "string", "pattern": "^[a-z0-9][a-z0-9._-]*$" },
        "type": {
          "enum": [
            "image",
            "editorial-illustration",
            "product-screenshot",
            "data-chart",
            "workflow-diagram",
            "system-diagram",
            "comparison-diagram",
            "timeline",
            "html-visualization",
            "typographic",
            "intentional-text",
            "none"
          ]
        },
        "required": { "type": "boolean" },
        "status": { "enum": ["planned", "ready", "missing", "not-needed"] },
        "source": { "enum": ["supplied", "generated", "screenshot", "css", "svg", "html", "chart", "none"] },
        "role": { "enum": ["evidence", "explanation", "context", "comparison", "decoration", "typography"] },
        "slot": { "type": "string", "pattern": "^[0-9]+(?:\\.[0-9]+)?\\s*[:x/]\\s*[0-9]+(?:\\.[0-9]+)?$" },
        "path": { "type": "string" },
        "alt": { "type": "string" },
        "focus": { "type": "string" },
        "prompt": { "type": "string" },
        "brief": { "type": "string" },
        "instructions": { "type": "string" },
        "exclusions": { "type": "array", "items": { "type": "string", "minLength": 1 }, "uniqueItems": true },
        "credit": { "type": "string" },
        "license": { "type": "string" },
        "notes": { "type": "string" }
      },
      "allOf": [
        {
          "if": {
            "properties": {
              "status": { "const": "ready" },
              "source": { "enum": ["supplied", "generated", "screenshot"] }
            },
            "required": ["status", "source"]
          },
          "then": { "required": ["path"] }
        }
      ],
      "additionalProperties": true
    }
  }
}
